{
  "schema_version": "static_knowledge_context_v1",
  "generated_at": "2026-07-18T10:55:50Z",
  "status": "context_only_not_validated",
  "knowledge_role": "static_prior",
  "truth_access": "forbidden",
  "truth_accessed": false,
  "may_change_meteorological_risk": false,
  "sources": [
    {
      "id": "WORLDCLIM21_ELEV_10M",
      "role": "terrain_context",
      "title": "WorldClim 2.1 elevation derived from SRTM",
      "source_url": "https://geodata.ucdavis.edu/climate/worldclim/2_1/base/wc2.1_10m_elev.zip",
      "landing_page_url": "https://www.worldclim.org/data/worldclim21.html",
      "archive_name": "wc2.1_10m_elev.zip",
      "archive_sha256": "6a9f4e9a37f289d594ed1567b63be344a4dacf247f0b69756e81df031087e3bd",
      "available_at": "2020-03-15T00:00:00Z",
      "reference_period_start": "1970-01-01T00:00:00Z",
      "reference_period_end": "2000-12-31T23:59:59Z",
      "recorded_at": "2026-07-18T10:55:50Z",
      "unit": "m",
      "license_or_terms": "WorldClim research and related activities; cite Fick and Hijmans (2017)",
      "citation": "Fick, S.E. and Hijmans, R.J. (2017), doi:10.1002/joc.5086"
    },
    {
      "id": "WORLDCLIM21_PREC_10M",
      "role": "precipitation_climatology",
      "title": "WorldClim 2.1 monthly precipitation climatology 1970-2000",
      "source_url": "https://geodata.ucdavis.edu/climate/worldclim/2_1/base/wc2.1_10m_prec.zip",
      "landing_page_url": "https://www.worldclim.org/data/worldclim21.html",
      "archive_name": "wc2.1_10m_prec.zip",
      "archive_sha256": "1090f578f6402672a2b6438e252156f6cf867a25002a8ad6ffcbfa19e516ddc6",
      "available_at": "2020-03-15T00:00:00Z",
      "reference_period_start": "1970-01-01T00:00:00Z",
      "reference_period_end": "2000-12-31T23:59:59Z",
      "recorded_at": "2026-07-18T10:55:50Z",
      "unit": "mm/month",
      "license_or_terms": "WorldClim research and related activities; cite Fick and Hijmans (2017)",
      "citation": "Fick, S.E. and Hijmans, R.J. (2017), doi:10.1002/joc.5086"
    }
  ],
  "profiles": [
    {
      "id": "SA-01:month01:worldclim21",
      "region_id": "SA-01",
      "region_name_en": "Riyadh Region",
      "month": 1,
      "prior_status": "context_only",
      "knowledge_prior_risk": null,
      "confidence": "low",
      "terrain": {
        "cell_count": 1192,
        "mean_m": 715.666,
        "p10_m": 463.0,
        "p50_m": 705.0,
        "p90_m": 980.0,
        "max_m": 1133.0,
        "p90_minus_p10_m": 517.0,
        "share_above_1000m": 0.072225
      },
      "precipitation_climatology": {
        "cell_count": 1192,
        "mean_mm": 10.67,
        "p90_mm": 17.0,
        "max_mm": 24.0
      },
      "temporal": {
        "reference_period_start": "1970-01-01T00:00:00Z",
        "reference_period_end": "2000-12-31T23:59:59Z",
        "available_at": "2020-03-15T00:00:00Z",
        "valid_from": "2020-03-15T00:00:00Z",
        "valid_to": null,
        "recorded_at": "2026-07-18T10:55:50Z"
      },
      "source_ids": [
        "WORLDCLIM21_ELEV_10M",
        "WORLDCLIM21_PREC_10M"
      ],
      "resolution_arc_minutes": 10
    },
    {
      "id": "SA-01:month02:worldclim21",
      "region_id": "SA-01",
      "region_name_en": "Riyadh Region",
      "month": 2,
      "prior_status": "context_only",
      "knowledge_prior_risk": null,
      "confidence": "low",
      "terrain": {
        "cell_count": 1192,
        "mean_m": 715.666,
        "p10_m": 463.0,
        "p50_m": 705.0,
        "p90_m": 980.0,
        "max_m": 1133.0,
        "p90_minus_p10_m": 517.0,
        "share_above_1000m": 0.072225
      },
      "precipitation_climatology": {
        "cell_count": 1192,
        "mean_mm": 8.244,
        "p90_mm": 13.0,
        "max_mm": 22.0
      },
      "temporal": {
        "reference_period_start": "1970-01-01T00:00:00Z",
        "reference_period_end": "2000-12-31T23:59:59Z",
        "available_at": "2020-03-15T00:00:00Z",
        "valid_from": "2020-03-15T00:00:00Z",
        "valid_to": null,
        "recorded_at": "2026-07-18T10:55:50Z"
      },
      "source_ids": [
        "WORLDCLIM21_ELEV_10M",
        "WORLDCLIM21_PREC_10M"
      ],
      "resolution_arc_minutes": 10
    },
    {
      "id": "SA-01:month03:worldclim21",
      "region_id": "SA-01",
      "region_name_en": "Riyadh Region",
      "month": 3,
      "prior_status": "context_only",
      "knowledge_prior_risk": null,
      "confidence": "low",
      "terrain": {
        "cell_count": 1192,
        "mean_m": 715.666,
        "p10_m": 463.0,
        "p50_m": 705.0,
        "p90_m": 980.0,
        "max_m": 1133.0,
        "p90_minus_p10_m": 517.0,
        "share_above_1000m": 0.072225
      },
      "precipitation_climatology": {
        "cell_count": 1192,
        "mean_mm": 37.591,
        "p90_mm": 47.0,
        "max_mm": 54.0
      },
      "temporal": {
        "reference_period_start": "1970-01-01T00:00:00Z",
        "reference_period_end": "2000-12-31T23:59:59Z",
        "available_at": "2020-03-15T00:00:00Z",
        "valid_from": "2020-03-15T00:00:00Z",
        "valid_to": null,
        "recorded_at": "2026-07-18T10:55:50Z"
      },
      "source_ids": [
        "WORLDCLIM21_ELEV_10M",
        "WORLDCLIM21_PREC_10M"
      ],
      "resolution_arc_minutes": 10
    },
    {
      "id": "SA-01:month04:worldclim21",
      "region_id": "SA-01",
      "region_name_en": "Riyadh Region",
      "month": 4,
      "prior_status": "context_only",
      "knowledge_prior_risk": null,
      "confidence": "low",
      "terrain": {
        "cell_count": 1192,
        "mean_m": 715.666,
        "p10_m": 463.0,
        "p50_m": 705.0,
        "p90_m": 980.0,
        "max_m": 1133.0,
        "p90_minus_p10_m": 517.0,
        "share_above_1000m": 0.072225
      },
      "precipitation_climatology": {
        "cell_count": 1192,
        "mean_mm": 26.023,
        "p90_mm": 34.0,
        "max_mm": 37.0
      },
      "temporal": {
        "reference_period_start": "1970-01-01T00:00:00Z",
        "reference_period_end": "2000-12-31T23:59:59Z",
        "available_at": "2020-03-15T00:00:00Z",
        "valid_from": "2020-03-15T00:00:00Z",
        "valid_to": null,
        "recorded_at": "2026-07-18T10:55:50Z"
      },
      "source_ids": [
        "WORLDCLIM21_ELEV_10M",
        "WORLDCLIM21_PREC_10M"
      ],
      "resolution_arc_minutes": 10
    },
    {
      "id": "SA-01:month05:worldclim21",
      "region_id": "SA-01",
      "region_name_en": "Riyadh Region",
      "month": 5,
      "prior_status": "context_only",
      "knowledge_prior_risk": null,
      "confidence": "low",
      "terrain": {
        "cell_count": 1192,
        "mean_m": 715.666,
        "p10_m": 463.0,
        "p50_m": 705.0,
        "p90_m": 980.0,
        "max_m": 1133.0,
        "p90_minus_p10_m": 517.0,
        "share_above_1000m": 0.072225
      },
      "precipitation_climatology": {
        "cell_count": 1192,
        "mean_mm": 9.656,
        "p90_mm": 14.0,
        "max_mm": 17.0
      },
      "temporal": {
        "reference_period_start": "1970-01-01T00:00:00Z",
        "reference_period_end": "2000-12-31T23:59:59Z",
        "available_at": "2020-03-15T00:00:00Z",
        "valid_from": "2020-03-15T00:00:00Z",
        "valid_to": null,
        "recorded_at": "2026-07-18T10:55:50Z"
      },
      "source_ids": [
        "WORLDCLIM21_ELEV_10M",
        "WORLDCLIM21_PREC_10M"
      ],
      "resolution_arc_minutes": 10
    },
    {
      "id": "SA-01:month06:worldclim21",
      "region_id": "SA-01",
      "region_name_en": "Riyadh Region",
      "month": 6,
      "prior_status": "context_only",
      "knowledge_prior_risk": null,
      "confidence": "low",
      "terrain": {
        "cell_count": 1192,
        "mean_m": 715.666,
        "p10_m": 463.0,
        "p50_m": 705.0,
        "p90_m": 980.0,
        "max_m": 1133.0,
        "p90_minus_p10_m": 517.0,
        "share_above_1000m": 0.072225
      },
      "precipitation_climatology": {
        "cell_count": 1192,
        "mean_mm": 0.811,
        "p90_mm": 2.0,
        "max_mm": 4.0
      },
      "temporal": {
        "reference_period_start": "1970-01-01T00:00:00Z",
        "reference_period_end": "2000-12-31T23:59:59Z",
        "available_at": "2020-03-15T00:00:00Z",
        "valid_from": "2020-03-15T00:00:00Z",
        "valid_to": null,
        "recorded_at": "2026-07-18T10:55:50Z"
      },
      "source_ids": [
        "WORLDCLIM21_ELEV_10M",
        "WORLDCLIM21_PREC_10M"
      ],
      "resolution_arc_minutes": 10
    },
    {
      "id": "SA-01:month07:worldclim21",
      "region_id": "SA-01",
      "region_name_en": "Riyadh Region",
      "month": 7,
      "prior_status": "context_only",
      "knowledge_prior_risk": null,
      "confidence": "low",
      "terrain": {
        "cell_count": 1192,
        "mean_m": 715.666,
        "p10_m": 463.0,
        "p50_m": 705.0,
        "p90_m": 980.0,
        "max_m": 1133.0,
        "p90_minus_p10_m": 517.0,
        "share_above_1000m": 0.072225
      },
      "precipitation_climatology": {
        "cell_count": 1192,
        "mean_mm": 0.338,
        "p90_mm": 1.0,
        "max_mm": 2.0
      },
      "temporal": {
        "reference_period_start": "1970-01-01T00:00:00Z",
        "reference_period_end": "2000-12-31T23:59:59Z",
        "available_at": "2020-03-15T00:00:00Z",
        "valid_from": "2020-03-15T00:00:00Z",
        "valid_to": null,
        "recorded_at": "2026-07-18T10:55:50Z"
      },
      "source_ids": [
        "WORLDCLIM21_ELEV_10M",
        "WORLDCLIM21_PREC_10M"
      ],
      "resolution_arc_minutes": 10
    },
    {
      "id": "SA-01:month08:worldclim21",
      "region_id": "SA-01",
      "region_name_en": "Riyadh Region",
      "month": 8,
      "prior_status": "context_only",
      "knowledge_prior_risk": null,
      "confidence": "low",
      "terrain": {
        "cell_count": 1192,
        "mean_m": 715.666,
        "p10_m": 463.0,
        "p50_m": 705.0,
        "p90_m": 980.0,